{
  "name": "Sample Library",
  "label": "Library · Example",
  "category": "library",
  "summary": "A fictional open-source library with no case study.",
  "description": "A sample library without a case study or media, so cards without images are covered (fixture).",
  "technologies": ["dart"],
  "role": "Maintainer (sample)",
  "contributions": ["Sample contribution one", "Sample contribution two"],
  "links": {
    "repo": "https://example.com/code/sample-lib"
  },
  "progress": "shipped",
  "featured": false,
  "status": "published"
}
